,Name,Main Tag,Tags,Rating,Num Reviews,Address,Zip Code,Neighborhood
2327,Sam's Sushi Bar & Grill,Sushi restaurant,"Sushi restaurant, Japanese restaurant",4.5,363.0,"Sam's Sushi Bar & Grill, 5506 22nd Ave NW, Seattle, WA 98107",98107,Ballard
2328,Mamnoon,Middle Eastern restaurant,Middle Eastern restaurant,4.3,1555.0,"Mamnoon, 1508 Melrose Ave, Seattle, WA 98122",98122,Capitol Hill
2329,Ludi's Restaurant,Breakfast restaurant,"Breakfast restaurant, American restaurant, Brunch restaurant, Filipino restaurant, Lunch restaurant",4.4,1237.0,"Ludi's Restaurant, 120 Stewart St, Seattle, WA 98101",98101,Downtown
2330,McDonald's,Fast food restaurant,"Fast food restaurant, Breakfast restaurant, Coffee shop, Hamburger restaurant, Restaurant, Sandwich shop",3.5,1654.0,"McDonald's, 5146 25th Ave NE, Seattle, WA 98105",98105,University District
2334,Canton Wonton House,Cantonese restaurant,"Cantonese restaurant, Asian fusion restaurant, Asian restaurant, Chinese restaurant, Chinese takeaway, Lunch restaurant",4.6,233.0,"Canton Wonton House, 608 S Weller St, Seattle, WA 98104",98104,Chinatown
2338,Bento World Sushi & Teriyaki,Restaurant,"Restaurant, Japanese restaurant, Korean restaurant, Sushi restaurant",4.5,277.0,"Bento World Sushi & Teriyaki, 306 Lenora St, Seattle, WA 98121",98121,Belltown
2339,Taqueria Jalisco,Taco restaurant,Taco restaurant,4.5,35.0,"Taqueria Jalisco, 1841 S 120th St, Seattle, WA 98168",98168,Other
2341,Hummus Cafe,Mediterranean restaurant,"Mediterranean restaurant, Egyptian restaurant",4.4,297.0,"Hummus Cafe, 8420 Greenwood Ave N, Seattle, WA 98103",98103,Fremont/Wallingford
2344,Eastlake Specialty Market,Deli,"Deli, Market",4.1,48.0,"Eastlake Specialty Market, 1540 Eastlake Ave E # D, Seattle, WA 98102",98102,Capitol Hill
2345,Prost! West Seattle,Bar,"Bar, German restaurant, Restaurant",4.5,410.0,"Prost! West Seattle, 3407 California Ave SW, Seattle, WA 98116",98116,Other
2346,The Dressing Room: Bistro and Bar By Can Can,Restaurant,"Restaurant, Bar, Bistro, Brunch restaurant",4.4,67.0,"The Dressing Room: Bistro and Bar By Can Can, 1530 1/2 Post Alley, Seattle, WA 98101",98101,Downtown
2349,Cactus South Lake Union,Mexican restaurant,"Mexican restaurant, American restaurant, Cocktail bar, Latin American restaurant, Southwestern restaurant (US)",4.4,3436.0,"Cactus South Lake Union, 350 Terry Ave N, Seattle, WA 98109",98109,Queen Anne/South Lake Union
2351,Momosan Seattle,Ramen restaurant,Ramen restaurant,4.2,511.0,"Momosan Seattle, 501 5th Ave S Suite 119, Seattle, WA 98104",98104,Chinatown
2353,The George & Dragon Pub,Bar,Bar,4.4,636.0,"The George & Dragon Pub, 206 N 36th St, Seattle, WA 98103",98103,Fremont/Wallingford
2354,Silence Heart Nest Vegetarian Restaurant,Vegetarian restaurant,"Vegetarian restaurant, Restaurant",4.5,290.0,"Silence Heart Nest Vegetarian Restaurant, 3508 Fremont Pl N, Seattle, WA 98103",98103,Fremont/Wallingford
2355,Seven Stars Pepper Szechwan Restaurant,Sichuan restaurant,"Sichuan restaurant, Chinese restaurant, Seafood restaurant",4.3,400.0,"Seven Stars Pepper Szechwan Restaurant, 1207 S Jackson St #211, Seattle, WA 98144",98144,Other
2356,Shanghai Garden,Chinese restaurant,"Chinese restaurant, Asian restaurant, Restaurant",4.3,424.0,"Shanghai Garden, 524 6th Ave S, Seattle, WA 98104",98104,Chinatown
2357,Verve Bowls - Capitol Hill,Restaurant,Restaurant,4.0,260.0,"Verve Bowls - Capitol Hill, In the, Pike Motor Works, 715 East Pine Street, Courtyard Suite K, Seattle, WA 98122",98122,Capitol Hill
2360,Rom Mai Thai Restaurant,Thai restaurant,Thai restaurant,4.4,488.0,"Rom Mai Thai Restaurant, 613 Broadway E, Seattle, WA 98102",98102,Capitol Hill
2361,El Moose,Mexican restaurant,"Mexican restaurant, Bar, Gluten-free restaurant, Vegetarian restaurant",4.6,1485.0,"El Moose, 5242 Leary Ave NW, Seattle, WA 98107",98107,Ballard
2362,Caffe Torino,Cafe,"Cafe, Brunch restaurant, Coffee shop, Pastry shop, Sandwich shop",4.2,202.0,"Caffe Torino, 422 Yale Ave N B, Seattle, WA 98109",98109,Queen Anne/South Lake Union
2363,Al Bacha Restaurant,Mediterranean restaurant,"Mediterranean restaurant, Restaurant",4.5,703.0,"Al Bacha Restaurant, 1833 Broadway, Seattle, WA 98122",98122,Capitol Hill
2365,Rocky Mountain Chocolate Factory,Chocolate shop,"Chocolate shop, Candy store, Dessert shop, Ice cream shop",4.4,482.0,"Rocky Mountain Chocolate Factory, 1419 1st Ave, Seattle, WA 98101",98101,Downtown
2366,Matt's Famous Chili Dogs,Fast food restaurant,"Fast food restaurant, Hamburger restaurant, Hot dog restaurant",4.5,988.0,"Matt's Famous Chili Dogs, 6615 E Marginal Way S, Seattle, WA 98108",98108,Other
2367,Alder & Ash,Restaurant,Restaurant,4.0,102.0,"Alder & Ash, 629 Pike St, Seattle, WA 98101",98101,Downtown
2370,Thai Star Restaurant,Thai restaurant,Thai restaurant,4.3,130.0,"Thai Star Restaurant, 1007 Boren Ave #1325, Seattle, WA 98104",98104,Chinatown
2372,Atlantic Street Pizza,Pizza restaurant,"Pizza restaurant, Delivery Restaurant, Takeout Restaurant, Pizza delivery, Pizza Takeout, Restaurant",2.8,29.0,"Atlantic Street Pizza, 999 3rd Ave, Seattle, WA 98104",98104,Chinatown
2373,Juicy Cafe,Juice shop,"Juice shop, Cafe, Restaurant, Vegetarian restaurant",4.3,164.0,"Juicy Cafe, 725 Pike St, Seattle, WA 98101",98101,Downtown
2374,Pei Wei,Pan-Asian restaurant,Pan-Asian restaurant,2.1,186.0,"Pei Wei, 17801 International Blvd, Seattle, WA 98158",98158,Other
2376,Meskel Restaurant,Ethiopian restaurant,"Ethiopian restaurant, Gluten-free restaurant, Restaurant, Vegan restaurant, Vegetarian restaurant",4.4,213.0,"Meskel Restaurant, 2605 E Cherry St, Seattle, WA 98122",98122,Capitol Hill
2378,Adana,Japanese restaurant,"Japanese restaurant, Restaurant",4.4,308.0,"Adana, 1449 E Pine St, Seattle, WA 98122",98122,Capitol Hill
2381,Meraki Tea Bar,Bubble tea store,"Bubble tea store, Restaurant",4.5,115.0,"Meraki Tea Bar, 4701 Brooklyn Ave NE, Seattle, WA 98105",98105,University District
2383,Mei Mei Cafe,Chinese restaurant,Chinese restaurant,4.4,115.0,"Mei Mei Cafe, 1004 NE 50th St, Seattle, WA 98105",98105,University District
2384,Conscious Eatery,Lunch restaurant,"Lunch restaurant, Breakfast restaurant, Brunch restaurant, Catering food and drink supplier",4.7,204.0,"Conscious Eatery, 5620 6th Ave S Building T, Seattle, WA 98108",98108,Other
2386,Red Onion Tavern,Bar,Bar,4.3,131.0,"Red Onion Tavern, 4210 E Madison St, Seattle, WA 98112",98112,Capitol Hill
2387,Fat Ducks Deli & Bakery,Deli,"Deli, Bakery, Sandwich shop",4.5,379.0,"Fat Ducks Deli & Bakery, 5509 University Way NE, Seattle, WA 98105",98105,University District
2389,Piatti,Italian restaurant,Italian restaurant,4.2,612.0,"Piatti, 2695 NE Village Lane, Seattle, WA 98105",98105,University District
2391,Safari Njema,African restaurant,African restaurant,4.2,71.0,"Safari Njema, 5041 Rainier Ave S suite 107, Seattle, WA 98118",98118,Other
2392,Thai 2go,Thai restaurant,"Thai restaurant, Chicken wings restaurant, Pizza Takeout",4.6,42.0,"Thai 2go, 7617 Aurora Ave N, Seattle, WA 98103",98103,Fremont/Wallingford
2393,Ballard Loft Sports Bar,Sports bar,"Sports bar, American restaurant, Bar, Brunch restaurant",4.1,336.0,"Ballard Loft Sports Bar, 5105 Ballard Ave NW, Seattle, WA 98107",98107,Ballard
2395,Evergreens,Restaurant,"Restaurant, Health food restaurant, Salad shop",4.2,184.0,"Evergreens, 4609 Village, Terrace Dr NE, Seattle, WA 98105",98105,University District
2398,UMINORI,Sushi restaurant,Sushi restaurant,4.3,97.0,"UMINORI, 2106 E Madison St, Seattle, WA 98112",98112,Capitol Hill
2400,The Fig & The Judge,Restaurant,Restaurant,3.7,35.0,"The Fig & The Judge, 515 Madison St, Seattle, WA 98104",98104,Chinatown
2401,Koku Cafe + Market,Japanese restaurant,"Japanese restaurant, Asian grocery store, Asian restaurant, Breakfast restaurant, Cafe, Coffee shop, Eclectic restaurant, Health food restaurant, Japanese delicatessen, Delivery Restaurant, Tea house",4.6,211.0,"Koku Cafe + Market, 1417 Queen Anne Ave N #101b, Seattle, WA 98109",98109,Queen Anne/South Lake Union
2402,Basil Box,Thai restaurant,Thai restaurant,3.8,21.0,"Basil Box, 701 5th Ave, Seattle, WA 98104",98104,Chinatown
2403,Jackalope Tex Mex & Cantina,Tex-Mex restaurant,"Tex-Mex restaurant, Barbecue restaurant, Brunch restaurant, Cocktail bar, Mexican restaurant",4.5,314.0,"Jackalope Tex Mex & Cantina, 4868 Rainier Ave S, Seattle, WA 98118",98118,Other
2404,McMenamins Queen Anne,Brewpub,"Brewpub, Brewery, Pub, Restaurant",4.3,387.0,"McMenamins Queen Anne, 200 Roy St #105, Seattle, WA 98109",98109,Queen Anne/South Lake Union
2405,Shodai Teriyaki,Asian fusion restaurant,"Asian fusion restaurant, Caterer, Chinese restaurant, Delivery Restaurant, Restaurant",3.8,219.0,"Shodai Teriyaki, 1123 Martin Luther King Jr Way, Seattle, WA 98122",98122,Capitol Hill
2406,Starbucks,Coffee shop,"Coffee shop, Breakfast restaurant, Cafe, Coffee store, Espresso bar, Internet cafe",4.2,485.0,"Starbucks, 4115 4th Ave S, Seattle, WA 98134",98134,Other
2408,Rainier Restaurant and BBQ,Vietnamese restaurant,Vietnamese restaurant,4.4,1099.0,"Rainier Restaurant and BBQ, 6400 Martin Luther King Jr Way S, Seattle, WA 98118",98118,Other
2409,Two Doors Down,Hamburger restaurant,"Hamburger restaurant, Restaurant",4.5,719.0,"Two Doors Down, 2332 E Madison St, Seattle, WA 98112",98112,Capitol Hill
2410,Serendipity Cafe,Family restaurant,"Family restaurant, Bar, Breakfast restaurant, Coffee shop, Lounge",4.3,587.0,"Serendipity Cafe, 3222A W McGraw St, Seattle, WA 98199",98199,Other
2411,Los Agaves At Pike,Mexican restaurant,"Mexican restaurant, Catering food and drink supplier, Caterer",4.3,426.0,"Los Agaves At Pike, 1514 Pike Pl #7, Seattle, WA 98101",98101,Downtown
2413,Caffe Ladro - South Lake Union Fairview,Coffee shop,Coffee shop,4.4,147.0,"Caffe Ladro - South Lake Union Fairview, 400 Fairview Ave N, Seattle, WA 98109",98109,Queen Anne/South Lake Union
2414,Aegis Living Queen Anne Galer,Assisted living facility,Assisted living facility,4.6,16.0,"Aegis Living Queen Anne Galer, 223 W Galer St, Seattle, WA 98119",98119,Other
2415,The Flora Bakehouse,Bakery,Bakery,4.7,370.0,"The Flora Bakehouse, 1511 S Lucile St, Seattle, WA 98108",98108,Other
2416,Cafe Allegro,Espresso bar,Espresso bar,4.5,691.0,"Cafe Allegro, Alleyway, 4214 University Way NE, Seattle, WA 98105",98105,University District
2417,Derby,New American restaurant,"New American restaurant, Automobile storage facility, Bar, Catering food and drink supplier, Event venue, Free parking lot, Restaurant",4.4,839.0,"Derby, 2233 6th Ave S, Seattle, WA 98134",98134,Other
2418,Pink Bee Curry and Sandwiches,Thai restaurant,Thai restaurant,4.6,356.0,"Pink Bee Curry and Sandwiches, 2010 NW 56th St, Seattle, WA 98107",98107,Ballard
2419,Monsoon Seattle,Vietnamese restaurant,"Vietnamese restaurant, Asian restaurant, Bar, Brunch restaurant, Cocktail bar, Delivery Chinese restaurant, Dim sum restaurant, Event venue, Seafood restaurant, Southeast Asian restaurant",4.5,1084.0,"Monsoon Seattle, 615 19th Ave E, Seattle, WA 98112",98112,Capitol Hill
2420,Smile Thai Cuisine,Thai restaurant,"Thai restaurant, Restaurant",4.4,206.0,"Smile Thai Cuisine, 6411 Latona Ave NE, Seattle, WA 98115",98115,Other
2422,Mantra Thai Restaurant & Bar,Thai restaurant,Thai restaurant,4.2,885.0,"Mantra Thai Restaurant & Bar, 2720 4th Ave #116, Seattle, WA 98121",98121,Belltown
2423,canon,Cocktail bar,"Cocktail bar, Restaurant",4.5,1482.0,"canon, 928 12th Ave, Seattle, WA 98122",98122,Capitol Hill
2427,Bluebird Ice Cream,Ice cream shop,"Ice cream shop, Brewery, Dessert shop",4.4,163.0,"Bluebird Ice Cream, 7415 Greenwood Ave N, Seattle, WA 98103",98103,Fremont/Wallingford
2428,Musashi's,Japanese restaurant,"Japanese restaurant, Restaurant, Sushi restaurant",4.5,1062.0,"Musashi's, 1400 N 45th St, Seattle, WA 98103",98103,Fremont/Wallingford
2429,Guanaco's Tacos Pupuseria,Salvadoran restaurant,"Salvadoran restaurant, Mexican restaurant, Restaurant, Taco restaurant",4.3,645.0,"Guanaco's Tacos Pupuseria, 4106 Brooklyn Ave NE #12-A, Seattle, WA 98105",98105,University District
2431,Original Bakery,Bakery,Bakery,4.7,240.0,"Original Bakery, 9253 45th Ave SW, Seattle, WA 98136",98136,Other
2433,China Harbor Restaurant,Chinese restaurant,"Chinese restaurant, Restaurant",3.9,880.0,"China Harbor Restaurant, 2040 Westlake Ave N #28, Seattle, WA 98109",98109,Queen Anne/South Lake Union
2435,sankaku onigiri cafe & bar,Japanese restaurant,Japanese restaurant,4.7,61.0,"sankaku onigiri cafe & bar, 1531 Melrose Ave, Seattle, WA 98122",98122,Capitol Hill
2436,Sal Y Limon,Bar & grill,Bar & grill,4.7,795.0,"Sal Y Limon, 10 Mercer St, Seattle, WA 98109",98109,Queen Anne/South Lake Union
2437,Knee High Stocking Co.,Bar,"Bar, Restaurant",4.4,500.0,"Knee High Stocking Co., 1356 E Olive Wy, Seattle, WA 98122",98122,Capitol Hill
2439,Caffe Ladro - Capitol Hill,Coffee shop,"Coffee shop, Pastry shop",4.3,243.0,"Caffe Ladro - Capitol Hill, 435 15th Ave E, Seattle, WA 98112",98112,Capitol Hill
2440,Peel & Press,Pizza restaurant,"Pizza restaurant, Bar, Italian restaurant",4.5,274.0,"Peel & Press, 6503 California Ave SW #1899, Seattle, WA 98136",98136,Other
2441,O'Ginger Bistro,Thai restaurant,"Thai restaurant, Restaurant",4.4,113.0,"O'Ginger Bistro, 6900 East Green Lake Way N, Seattle, WA 98115",98115,Other
2443,Fiddler's Inn Pub & Pizza,Pub,"Pub, American restaurant, Beer garden, Takeout Restaurant, Pizza restaurant, Pizza Takeout, Restaurant, Sandwich shop",4.5,538.0,"Fiddler's Inn Pub & Pizza, 9219 35th Ave NE, Seattle, WA 98115",98115,Other
2445,Macrina Bakery,Bakery,Bakery,4.5,551.0,"Macrina Bakery, 615 W McGraw St, Seattle, WA 98119",98119,Other
2446,Andaluca Restaurant,Fine dining restaurant,"Fine dining restaurant, Breakfast restaurant, Restaurant",4.5,386.0,"Andaluca Restaurant, 407 Olive Wy, Seattle, WA 98101",98101,Downtown
2447,Little Duck,Chinese restaurant,Chinese restaurant,4.0,77.0,"Little Duck, 4100 Roosevelt Way NE, Seattle, WA 98105",98105,University District
2448,Jae's Asian Bistro & Sushi,Japanese restaurant,"Japanese restaurant, Sushi restaurant",4.7,76.0,"Jae's Asian Bistro & Sushi, 2801 E Madison St, Seattle, WA 98112",98112,Capitol Hill
2449,Pho My Chau Restaurant,Vietnamese restaurant,Vietnamese restaurant,4.3,225.0,"Pho My Chau Restaurant, Parking lot, 7101 Martin Luther King Jr Way S, Seattle, WA 98118",98118,Other
2450,The George,Pacific Northwest restaurant (US),"Pacific Northwest restaurant (US), Restaurant",4.3,448.0,"The George, 411 University St, Seattle, WA 98101",98101,Downtown
2451,Mashiko Japanese Restaurant,Japanese restaurant,"Japanese restaurant, Restaurant, Sushi restaurant",4.5,776.0,"Mashiko Japanese Restaurant, 4725 California Ave SW, Seattle, WA 98116",98116,Other
2452,El Camino,Mexican restaurant,"Mexican restaurant, Bar",4.3,1341.0,"El Camino, 607 N 35th St, Seattle, WA 98103",98103,Fremont/Wallingford
2454,Madison Park Bakery,Bakery,"Bakery, Coffee shop",4.4,113.0,"Madison Park Bakery, 4214 E Madison St, Seattle, WA 98112",98112,Capitol Hill
2455,El Borracho Ballard,Vegan restaurant,"Vegan restaurant, Bar",4.3,1218.0,"El Borracho Ballard, 5465 Leary Ave NW, Seattle, WA 98107",98107,Ballard
2460,Pineapple Bistro & Bar,Cocktail bar,"Cocktail bar, Bar & grill",4.3,100.0,"Pineapple Bistro & Bar, 300 Roy St #101, Seattle, WA 98109",98109,Queen Anne/South Lake Union
2461,Taco Bell,Fast food restaurant,"Fast food restaurant, Burrito restaurant, Takeout Restaurant, Mexican restaurant, Restaurant, Taco restaurant, Tex-Mex restaurant",2.8,1021.0,"Taco Bell, 210 W Mercer St, Seattle, WA 98119",98119,Other
2462,Starbucks,Coffee shop,"Coffee shop, Breakfast restaurant, Cafe, Coffee store, Espresso bar, Internet cafe",4.3,250.0,"Starbucks, 14330 Lake City Way NE, Seattle, WA 98125",98125,Northgate
2464,Mr Saigon,Restaurant,Restaurant,4.6,54.0,"Mr Saigon, 161 S Washington St, Seattle, WA 98104",98104,Chinatown
2470,Flying Bike Cooperative Brewery,Brewery,"Brewery, Bar",4.8,263.0,"Flying Bike Cooperative Brewery, 8570 Greenwood Ave N, Seattle, WA 98103",98103,Fremont/Wallingford
2472,Fat's Chicken and Waffles,Southern restaurant (US),"Southern restaurant (US), Breakfast restaurant, Restaurant",4.6,1595.0,"Fat's Chicken and Waffles, 2726 E Cherry St, Seattle, WA 98122",98122,Capitol Hill
2473,Sichuanese Cuisine,Sichuan restaurant,"Sichuan restaurant, Restaurant",4.4,746.0,"Sichuanese Cuisine, 1048 S Jackson St, Seattle, WA 98104",98104,Chinatown
2477,Pearls Tea & Coffee,Coffee shop,"Coffee shop, Tea house",4.1,231.0,"Pearls Tea & Coffee, 4800 Delridge Way SW, Seattle, WA 98106",98106,Other
2478,HoneyHole Sandwiches,Restaurant,"Restaurant, Bar & grill, Sandwich shop",4.6,2068.0,"HoneyHole Sandwiches, 703 E Pike St, Seattle, WA 98122",98122,Capitol Hill
2479,Original Deli,Restaurant,Restaurant,4.8,178.0,"Original Deli, 1215 4th Ave # A-B, Seattle, WA 98161",98161,Other
2480,Bauhaus Capitol Hill,Coffee shop,Coffee shop,4.4,43.0,"Bauhaus Capitol Hill, 515 Harvard Ave E #121, Seattle, WA 98102",98102,Capitol Hill
2481,The Masonry,Bar,"Bar, Pizza restaurant",4.6,787.0,"The Masonry, 20 Roy St, Seattle, WA 98109",98109,Queen Anne/South Lake Union
2484,New China Express,Chinese restaurant,"Chinese restaurant, Delivery Restaurant, Seafood restaurant",4.4,144.0,"New China Express, 2809 Thorndyke Ave W #2986, Seattle, WA 98199",98199,Other
2485,Artisan Cafe,Cafe,"Cafe, Coffee shop, Takeout Restaurant, Sandwich shop",4.6,206.0,"Artisan Cafe, 2523 5th Ave, Seattle, WA 98121",98121,Belltown
2486,Pig Iron Burger Shack,Hamburger restaurant,"Hamburger restaurant, Bar & grill",4.5,174.0,"Pig Iron Burger Shack, 5602 1st Ave S, Seattle, WA 98108",98108,Other
2487,Magic Dragon,Chinese restaurant,"Chinese restaurant, Restaurant",4.6,514.0,"Magic Dragon, 1827 15th Ave W #A10, Seattle, WA 98119",98119,Other
2489,Thai Siam Restaurant,Thai restaurant,"Thai restaurant, Restaurant",4.5,752.0,"Thai Siam Restaurant, 8305 15th Ave NW, Seattle, WA 98117",98117,Other
2491,Korean Bamboo,Korean restaurant,"Korean restaurant, Restaurant",4.4,804.0,"Korean Bamboo, 2236 3rd Ave, Seattle, WA 98121",98121,Belltown
2494,Thai Fusion Bistro,Thai restaurant,"Thai restaurant, Restaurant",3.8,252.0,"Thai Fusion Bistro, 323 NE Thornton Pl, Seattle, WA 98125",98125,Northgate
2496,TRACE Market,Restaurant,"Restaurant, Bar, Lounge, Wine bar",4.1,211.0,"TRACE Market, 1112 4th Ave, Seattle, WA 98101",98101,Downtown
2498,Fresh Flours South Lake Union,Coffee shop,"Coffee shop, Bakery",4.5,299.0,"Fresh Flours South Lake Union, 432 8th Ave N, Seattle, WA 98109",98109,Queen Anne/South Lake Union
2499,Vito's,Italian restaurant,Italian restaurant,4.5,822.0,"Vito's, 927 9th Ave, Seattle, WA 98104",98104,Chinatown
2501,Diane's Market Kitchen,Culinary school,Culinary school,5.0,27.0,"Diane's Market Kitchen, 1101 Post Ave, Seattle, WA 98101",98101,Downtown
2502,Bites of Bangkok,Thai restaurant,"Thai restaurant, Cocktail bar, Takeout Restaurant",4.3,227.0,"Bites of Bangkok, 340 15th Ave E #201, Seattle, WA 98112",98112,Capitol Hill
2506,Porchlight Coffee & Records,Coffee shop,"Coffee shop, Record store",4.4,187.0,"Porchlight Coffee & Records, 1517 14th Ave, Seattle, WA 98122",98122,Capitol Hill
2507,FlintCreek Cattle Co,New American restaurant,"New American restaurant, Restaurant",4.6,1307.0,"FlintCreek Cattle Co, 8421 Greenwood Ave N, Seattle, WA 98103",98103,Fremont/Wallingford
2508,Tammy's Deli & Bakery,Deli,"Deli, Bakery",3.6,256.0,"Tammy's Deli & Bakery, Parking lot, 7101 Martin Luther King Jr Way S, Seattle, WA 98118",98118,Other
2509,Kaffeeklatsch Seattle,Bakery,"Bakery, Cafe, Coffee shop, German restaurant, Pretzel store",4.5,733.0,"Kaffeeklatsch Seattle, 12513 Lake City Way NE H, Seattle, WA 98125",98125,Northgate
2510,Woodland Coffee,Coffee shop,Coffee shop,4.7,303.0,"Woodland Coffee, 1417 NW 54th St #101, Seattle, WA 98107",98107,Ballard
2511,Soup & Ladle,Soup restaurant,"Soup restaurant, Sandwich shop",3.8,12.0,"Soup & Ladle, 701 5th Ave #114, Seattle, WA 98104",98104,Chinatown
2513,The Scene in South Park,Coffee shop,"Coffee shop, Cafe",4.7,441.0,"The Scene in South Park, 1249 S Cloverdale St, Seattle, WA 98108",98108,Other
2514,Sunny Teriyaki #9,Japanese restaurant,"Japanese restaurant, Asian restaurant",4.2,65.0,"Sunny Teriyaki #9, 13754 Aurora Ave N, Seattle, WA 98133",98133,Bitter Lake
2516,Potbelly,Sandwich shop,"Sandwich shop, Beverage distributor, Caterer, Deli, Lunch restaurant, Restaurant supply store",4.0,365.0,"Potbelly, 2030 6th Ave, Seattle, WA 98121",98121,Belltown
2518,Van Gogh Coffeehouse,Cafe,Cafe,4.6,241.0,"Van Gogh Coffeehouse, 8210 35th Ave NE, Seattle, WA 98115",98115,Other
2519,Nate's Wings & Waffles,American restaurant,"American restaurant, Restaurant",4.2,525.0,"Nate's Wings & Waffles, 1224 E Jefferson St, Seattle, WA 98122",98122,Capitol Hill
2521,Salvadorean Bakery and Restaurant Inc.,Salvadoran restaurant,"Salvadoran restaurant, Bakery, Breakfast restaurant, Restaurant, Wholesale bakery",4.0,776.0,"Salvadorean Bakery and Restaurant Inc., 1719 SW Roxbury St, Seattle, WA 98106",98106,Other
2522,Cafe Con Leche,Cuban restaurant,"Cuban restaurant, Latin American restaurant, Restaurant",4.6,512.0,"Cafe Con Leche, 2901 1st Ave S, Seattle, WA 98134",98134,Other
2525,Twenty20 Mad Apartments,Apartment complex,Apartment complex,4.1,52.0,"Twenty20 Mad Apartments, 2020 E Madison St, Seattle, WA 98122",98122,Capitol Hill
2526,Lola,Greek restaurant,"Greek restaurant, Breakfast restaurant, Brunch restaurant, Mediterranean restaurant",4.4,3610.0,"Lola, 2000 B 4th Ave, Seattle, WA 98121",98121,Belltown
2527,Maritime Pacific Brewing Company,Brewery,"Brewery, Brewpub",4.5,40.0,"Maritime Pacific Brewing Company, 1111 NW Ballard Way, Seattle, WA 98107",98107,Ballard
2528,Union Saloon,American restaurant,"American restaurant, Bar",4.7,357.0,"Union Saloon, 3645 Wallingford Ave N, Seattle, WA 98103",98103,Fremont/Wallingford
2529,Beacon Grill,American restaurant,"American restaurant, Bar",4.2,114.0,"Beacon Grill, 4101 Beacon Ave S, Seattle, WA 98108",98108,Other
2531,Jose's Taqueria,Mexican restaurant,Mexican restaurant,4.0,87.0,"Jose's Taqueria, 12334 Lake City Way NE, Seattle, WA 98125",98125,Northgate
2533,Frank's Oyster House & Champagne Parlor,New American restaurant,"New American restaurant, Bar, Cocktail bar, Hamburger restaurant, Restaurant, Seafood restaurant",4.4,364.0,"Frank's Oyster House & Champagne Parlor, 2616 NE 55th St, Seattle, WA 98105",98105,University District
2535,The Swinery,Butcher shop,"Butcher shop, Takeout Restaurant",4.7,242.0,"The Swinery, 3207 California Ave SW, Seattle, WA 98116",98116,Other
2536,The Whale Wins,Small plates restaurant,"Small plates restaurant, Bar, Cafe, Coffee shop, Restaurant, Wine store",4.4,599.0,"The Whale Wins, 3506 Stone Way N, Seattle, WA 98103",98103,Fremont/Wallingford
2537,Fremont Brewing's Urban Beer Garden,Brewery,"Brewery, Beer garden, Beer hall, Beer store",4.7,1818.0,"Fremont Brewing's Urban Beer Garden, 1050 N 34th St, Seattle, WA 98103",98103,Fremont/Wallingford
2538,Bateau,Steak house,"Steak house, Restaurant",4.5,703.0,"Bateau, 1040 E Union St, Seattle, WA 98122",98122,Capitol Hill
2539,Jude's,Restaurant,Restaurant,4.6,325.0,"Jude's, 9252 57th Ave S, Seattle, WA 98118",98118,Other
2542,Wann Japanese Izakaya,Japanese restaurant,"Japanese restaurant, Bar, Izakaya restaurant, Ramen restaurant",4.4,840.0,"Wann Japanese Izakaya, 2020 2nd Ave, Seattle, WA 98121",98121,Belltown
2543,Genghis Khan Restaurant,Chinese restaurant,"Chinese restaurant, Asian fusion restaurant, Asian restaurant, Restaurant, Sichuan restaurant",3.3,270.0,"Genghis Khan Restaurant, 82 Stewart St, Seattle, WA 98101",98101,Downtown
2545,Bell Harbor Marina,Marina,Marina,4.6,235.0,"Bell Harbor Marina, 2203 Alaskan Wy, Seattle, WA 98121",98121,Belltown
2546,Palermo Pizza & Pasta Capitol Hill,Pizza restaurant,"Pizza restaurant, Caterer, Italian restaurant, Takeout Restaurant, Pizza delivery, Pizza Takeout",4.2,551.0,"Palermo Pizza & Pasta Capitol Hill, 350 15th Ave E, Seattle, WA 98112",98112,Capitol Hill
2547,Coffee Tree,Coffee shop,"Coffee shop, Bakery, Bubble tea store, Lunch restaurant, Sandwich shop",4.4,221.0,"Coffee Tree, 905 8th Ave, Seattle, WA 98104",98104,Chinatown
2548,Taco Bell,Fast food restaurant,"Fast food restaurant, Breakfast restaurant, Burrito restaurant, Lunch restaurant, Takeout Restaurant, Mexican restaurant, Restaurant, Taco restaurant, Tex-Mex restaurant, Vegetarian restaurant",3.6,335.0,"Taco Bell, 9401 Rainier Ave S, Seattle, WA 98118",98118,Other
2549,Miner's Landing Pier 57 Seattle,Amusement center,"Amusement center, Bakery, Event venue, Ferris wheel, Food court, Ice cream shop, Photo booth, Recreation center, Seafood restaurant, Video arcade",4.5,943.0,"Miner's Landing Pier 57 Seattle, 1301 Alaskan Wy, Seattle, WA 98101",98101,Downtown
2550,San Fermo,Italian restaurant,Italian restaurant,4.4,837.0,"San Fermo, 5341 Ballard Ave NW, Seattle, WA 98107",98107,Ballard
2551,Thirsty Fish,Bar & grill,Bar & grill,4.5,325.0,"Thirsty Fish, 9041 Holman Rd NW, Seattle, WA 98117",98117,Other
2552,Mammoth,Sandwich shop,"Sandwich shop, Gastropub, Restaurant",4.5,688.0,"Mammoth, 220 Mercer St, Seattle, WA 98109",98109,Queen Anne/South Lake Union
2554,San Patricio Events,Mexican restaurant,"Mexican restaurant, Restaurant",3.9,415.0,"San Patricio Events, 1914 Post Alley, Seattle, WA 98101",98101,Downtown
2555,The Olive and Grape,Turkish restaurant,"Turkish restaurant, Italian restaurant, Mediterranean restaurant",4.5,341.0,"The Olive and Grape, 8516 Greenwood Ave N, Seattle, WA 98103",98103,Fremont/Wallingford
2556,Harbor Place Condos,Condominium complex,Condominium complex,4.4,7.0,"Harbor Place Condos, 3318 30th Ave SW UNIT A, Seattle, WA 98126",98126,Other
2557,Nordstrom Ebar Artisan Coffee,Coffee shop,Coffee shop,4.6,5.0,"Nordstrom Ebar Artisan Coffee, 401 NE Northgate Way, Seattle, WA 98125",98125,Northgate
2560,Sen Noodle Bar,Noodle shop,"Noodle shop, Southeast Asian restaurant, Thai restaurant",4.6,406.0,"Sen Noodle Bar, 2307 NW Market St, Seattle, WA 98107",98107,Ballard
