,Name,Main Tag,Tags,Rating,Num Reviews,Address,Zip Code,Neighborhood
1581,Starbucks,Coffee shop,"Coffee shop, Breakfast restaurant, Cafe, Coffee store, Espresso bar, Internet cafe",4.4,174.0,"Starbucks, 121 Lakeside Ave, Seattle, WA 98122",98122,Capitol Hill
1582,Schmaltzy's Delicatessen,Jewish restaurant,Jewish restaurant,4.6,308.0,"Schmaltzy's Delicatessen, 928 Leary Wy NW Suite #102, Seattle, WA 98107",98107,Ballard
1584,SabbVerr Thai Bar & Grill,Thai restaurant,"Thai restaurant, Restaurant",4.3,385.0,"SabbVerr Thai Bar & Grill, 3410 Fremont Ave N, Seattle, WA 98103",98103,Fremont/Wallingford
1585,Basilic Essentially Thai,Thai restaurant,Thai restaurant,4.3,336.0,"Basilic Essentially Thai, 352 Roy St, Seattle, WA 98109",98109,Queen Anne/South Lake Union
1586,45th Stop N Shop & Poke Bar,Poke bar,"Poke bar, Convenience store, Japanese regional restaurant, Sushi restaurant",4.7,755.0,"45th Stop N Shop & Poke Bar, 2323 N 45th St, Seattle, WA 98103",98103,Fremont/Wallingford
1587,"Fish On Bait, Tackle Shop, and Cafe",Bait shop,"Bait shop, Fish & chips restaurant",4.2,29.0,"Fish On Bait, Tackle Shop, and Cafe, 955 Alaskan Way W, Seattle, WA 98119",98119,Other
1588,Michou Deli,Deli,"Deli, Delivery Restaurant",4.5,550.0,"Michou Deli, 1904 Pike Pl, Seattle, WA 98101",98101,Downtown
1589,Sarajevo Nightclub,Night club,Night club,4.0,797.0,"Sarajevo Nightclub, 2218 Western Ave #100, Seattle, WA 98121",98121,Belltown
1591,Buddha Bruddah Seattle,Asian fusion restaurant,"Asian fusion restaurant, Catering food and drink supplier, Restaurant",4.5,537.0,"Buddha Bruddah Seattle, 2201 Rainier Ave S, Seattle, WA 98144",98144,Other
1592,TangleTown Public House,Restaurant,"Restaurant, Bar",4.3,244.0,"TangleTown Public House, 2106 N 55th St, Seattle, WA 98103",98103,Fremont/Wallingford
1593,LECT's Soup Stop,Soup restaurant,"Soup restaurant, Takeout Restaurant, Restaurant, Sandwich shop",4.7,171.0,"LECT's Soup Stop, 5327 Denver Ave S, Seattle, WA 98108",98108,Other
1595,Mint and olives,Mediterranean restaurant,"Mediterranean restaurant, Middle Eastern restaurant, Restaurant",4.7,309.0,"Mint and olives, 8 W Mercer St, Seattle, WA 98119",98119,Other
1597,Starbucks,Coffee shop,"Coffee shop, Breakfast restaurant, Cafe, Coffee store, Espresso bar, Internet cafe",4.3,563.0,"Starbucks, 442 Terry Ave N, Seattle, WA 98109",98109,Queen Anne/South Lake Union
1598,Sunfish,Seafood restaurant,"Seafood restaurant, Restaurant",4.6,761.0,"Sunfish, 2800 Alki Ave SW, Seattle, WA 98116",98116,Other
1600,Bill's Off Broadway,Sports bar,"Sports bar, Bar, Restaurant",4.2,414.0,"Bill's Off Broadway, 725 E Pine St, Seattle, WA 98122",98122,Capitol Hill
1602,Mercado Luna,Mexican restaurant,"Mexican restaurant, Bar, Takeout Restaurant, Restaurant, Taco restaurant",4.4,1121.0,"Mercado Luna, 422 E Pine St, Seattle, WA 98122",98122,Capitol Hill
1605,Caffe Vita,Coffee shop,Coffee shop,4.5,352.0,"Caffe Vita, 5028 Wilson Ave S, Seattle, WA 98118",98118,Other
1607,Pacific Science Center,Science museum,"Science museum, Museum, Technology museum, Tourist attraction",4.5,6377.0,"Pacific Science Center, 200 2nd Ave N, Seattle, WA 98109",98109,Queen Anne/South Lake Union
1608,Kangaroo & Kiwi,Australian restaurant,"Australian restaurant, Bar, Bar & grill, Brunch restaurant, Lunch restaurant, Pub, Restaurant, Sports bar",4.3,1051.0,"Kangaroo & Kiwi, 2026 NW Market St, Seattle, WA 98107",98107,Ballard
1609,Maiz Taqueria,Mexican restaurant,"Mexican restaurant, Breakfast restaurant, Brunch restaurant, Restaurant, Taco restaurant",4.5,440.0,"Maiz Taqueria, 7301 15th Ave NW, Seattle, WA 98117",98117,Other
1610,Fortune Garden,Chinese restaurant,Chinese restaurant,4.3,338.0,"Fortune Garden, 424 Maynard Ave S, Seattle, WA 98104",98104,Chinatown
1611,FareStart,Non-profit organization,"Non-profit organization, Cafe, Caterer, Event venue, Restaurant",4.6,664.0,"FareStart, 700 Virginia St, Seattle, WA 98101",98101,Downtown
1612,JarrBar,Bar,Bar,4.4,260.0,"JarrBar, 1432 Western Ave, Seattle, WA 98101",98101,Downtown
1615,Tian Fu Seattle,Chinese restaurant,Chinese restaurant,4.0,346.0,"Tian Fu Seattle, 300 NE Northgate Way, Seattle, WA 98125",98125,Northgate
1617,Jimmy John's,Sandwich shop,"Sandwich shop, Caterer, Fast food restaurant, Delivery Restaurant, Takeout Restaurant",3.2,166.0,"Jimmy John's, 102 1st Ave S, Seattle, WA 98104",98104,Chinatown
1618,Pacific Inn Pub,Pub,"Pub, Bar",4.5,1107.0,"Pacific Inn Pub, 3501 Stone Way N, Seattle, WA 98103",98103,Fremont/Wallingford
1620,Tacos Chukis,Mexican restaurant,"Mexican restaurant, Fast food restaurant",4.6,2602.0,"Tacos Chukis, 832 Dexter Ave N, Seattle, WA 98109",98109,Queen Anne/South Lake Union
1621,IHOP,Breakfast restaurant,"Breakfast restaurant, American restaurant, Family restaurant",4.1,3179.0,"IHOP, 950 E Madison St, Seattle, WA 98122",98122,Capitol Hill
1622,Sushi Maki,Sushi restaurant,"Sushi restaurant, Asian restaurant, Japanese restaurant",4.5,224.0,"Sushi Maki, 1633 Bellevue Ave, Seattle, WA 98122",98122,Capitol Hill
1624,Dona Queen Donuts & Deli,Donut shop,Donut shop,4.4,191.0,"Dona Queen Donuts & Deli, 2445 4th Ave S #114, Seattle, WA 98134",98134,Other
1626,Sushi Suzuki,Sushi restaurant,Sushi restaurant,4.8,60.0,"Sushi Suzuki, 4116 1/2 E Madison St, Seattle, WA 98112",98112,Capitol Hill
1627,"TAT'S DELI - Cheesesteaks, Subs & Catering",Caterer,"Caterer, Cheesesteak restaurant, Deli, Restaurant, Sandwich shop",4.7,2248.0,"TAT'S DELI - Cheesesteaks, Subs & Catering, 159 Yesler Wy, Seattle, WA 98104",98104,Chinatown
1628,Skillet Diner @ Capitol Hill,New American restaurant,"New American restaurant, Bar, Breakfast restaurant, Brunch restaurant",4.3,2272.0,"Skillet Diner @ Capitol Hill, 1400 E Union St, Seattle, WA 98122",98122,Capitol Hill
1629,Gorgeous George's,Mediterranean restaurant,Mediterranean restaurant,4.8,428.0,"Gorgeous George's, 7719 Greenwood Ave N, Seattle, WA 98103",98103,Fremont/Wallingford
1630,Hopvine Pub,Pub,"Pub, Delivery service, Lunch restaurant, Delivery Restaurant, Takeout Restaurant, Pizza restaurant, Pizza Takeout, Sandwich shop, Soup shop",4.5,404.0,"Hopvine Pub, 507 15th Ave E, Seattle, WA 98112",98112,Capitol Hill
1631,Target,Department store,Department store,2.9,120.0,"Target, 4535 University Way NE, Seattle, WA 98105",98105,University District
1632,Starbucks,Coffee shop,"Coffee shop, Cafe, Coffee store, Espresso bar",4.0,74.0,"Starbucks, 516 1st Ave W, Seattle, WA 98109",98109,Queen Anne/South Lake Union
1634,Taqueria Cantina - Downtown,Mexican restaurant,Mexican restaurant,4.0,346.0,"Taqueria Cantina - Downtown, 89 University St, Seattle, WA 98101",98101,Downtown
1636,Magnolia Village Pub,Pub,"Pub, Bar & grill",4.3,393.0,"Magnolia Village Pub, 3221 W McGraw St, Seattle, WA 98199",98199,Other
1637,McDonald's,Fast food restaurant,"Fast food restaurant, Breakfast restaurant, Coffee shop, Hamburger restaurant, Restaurant, Sandwich shop",3.5,1247.0,"McDonald's, 2336 25th Ave S, Seattle, WA 98144",98144,Other
1638,Crepe De France,Creperie,"Creperie, Cafe, French restaurant, Restaurant",4.3,441.0,"Crepe De France, 93 Pike St #204, Seattle, WA 98101",98101,Downtown
1639,Cornelly,Pizza restaurant,"Pizza restaurant, Italian restaurant, Restaurant",4.6,273.0,"Cornelly, 601 Summit Ave E #103, Seattle, WA 98102",98102,Capitol Hill
1641,The Noble Fir,Cider bar,"Cider bar, Bar, Small plates restaurant, Wine bar",4.5,321.0,"The Noble Fir, 5316 Ballard Ave NW, Seattle, WA 98107",98107,Ballard
1644,Deli Shez Cafe,Mediterranean restaurant,"Mediterranean restaurant, Cafe",4.1,82.0,"Deli Shez Cafe, 318 Blanchard St, Seattle, WA 98121",98121,Belltown
1645,morfire,Hot pot restaurant,"Hot pot restaurant, Asian restaurant, Restaurant, Thai restaurant",4.6,335.0,"morfire, 1806 12th Ave Suite 100, Seattle, WA 98122",98122,Capitol Hill
1648,Ginger Lime,Restaurant,"Restaurant, Sandwich shop",4.0,4.0,"Ginger Lime, 732 12th Ave, Seattle, WA 98122",98122,Capitol Hill
1649,Subway,Sandwich shop,"Sandwich shop, Caterer, Fast food restaurant, Takeout Restaurant, Restaurant",3.4,60.0,"Subway, 806 12th Ave, Seattle, WA 98122",98122,Capitol Hill
1651,Panda Master,Mandarin restaurant,"Mandarin restaurant, Hot pot restaurant, Noodle shop, Snack bar, Tea house",3.0,93.0,"Panda Master, 4500 9th Ave NE, Seattle, WA 98105",98105,University District
1652,Adey Abeba Ethiopian Restaurant,Ethiopian restaurant,Ethiopian restaurant,4.5,263.0,"Adey Abeba Ethiopian Restaurant, 2123 E Union St, Seattle, WA 98122",98122,Capitol Hill
1654,Mason's Famous Lobster Rolls,Seafood restaurant,"Seafood restaurant, Catering food and drink supplier, Caterer, Family restaurant, Fast food restaurant, Lunch restaurant, Takeout Restaurant, New England restaurant, Restaurant, Sandwich shop",4.5,261.0,"Mason's Famous Lobster Rolls, 1307 1st Ave, Seattle, WA 98101",98101,Downtown
1655,Sam's Tavern,Hamburger restaurant,"Hamburger restaurant, Bar, Restaurant",4.3,828.0,"Sam's Tavern, 1024 E Pike St, Seattle, WA 98122",98122,Capitol Hill
1656,Cloud City Coffee,Cafe,"Cafe, Bakery, Breakfast restaurant, Coffee roasters, Coffee shop, Espresso bar, Lunch restaurant, Restaurant",4.7,887.0,"Cloud City Coffee, 8801 Roosevelt Way NE, Seattle, WA 98115",98115,Other
1657,Karaage Setsuna,Japanese restaurant,Japanese restaurant,4.6,770.0,"Karaage Setsuna, 2429 2nd Ave, Seattle, WA 98121",98121,Belltown
1660,Ballard Coffee Works,Cafe,"Cafe, Coffee shop, Espresso bar, Takeout Restaurant, Sandwich shop",4.6,1092.0,"Ballard Coffee Works, 2060 NW Market St, Seattle, WA 98107",98107,Ballard
1661,Tavern Law,Bar,"Bar, Lounge",4.4,990.0,"Tavern Law, 1406 12th Ave, Seattle, WA 98122",98122,Capitol Hill
1662,Wasabi Sushi & Izakaya,Japanese restaurant,"Japanese restaurant, Izakaya restaurant, Sushi restaurant",4.4,1985.0,"Wasabi Sushi & Izakaya, 2311 2nd Ave, Seattle, WA 98121",98121,Belltown
1663,Raised Doughnuts and Cakes,Donut shop,Donut shop,4.6,381.0,"Raised Doughnuts and Cakes, 2301 E Union St Suite L, Seattle, WA 98122",98122,Capitol Hill
1666,Midtown Espresso,Cafe,Cafe,4.5,84.0,"Midtown Espresso, 2133 5th Ave, Seattle, WA 98121",98121,Belltown
1667,Bush Garden,Karaoke bar,"Karaoke bar, Restaurant",4.4,248.0,"Bush Garden, 714 S King St, Seattle, WA 98104",98104,Chinatown
1668,Kidd Valley,Hamburger restaurant,"Hamburger restaurant, Fast food restaurant",4.3,862.0,"Kidd Valley, 4910 Green Lake Way N, Seattle, WA 98103",98103,Fremont/Wallingford
1674,Maharaja Cuisine of India,Indian restaurant,"Indian restaurant, Bar, Lounge",4.2,1154.0,"Maharaja Cuisine of India, 4542 California Ave SW, Seattle, WA 98116",98116,Other
1675,Starbucks,Coffee shop,"Coffee shop, Breakfast restaurant, Cafe, Coffee store, Espresso bar, Internet cafe",4.2,790.0,"Starbucks, 4147 University Way NE, Seattle, WA 98105",98105,University District
1676,G.H PASTA Co.,Italian restaurant,Italian restaurant,4.5,498.0,"G.H PASTA Co., 2305 6th Ave, Seattle, WA 98121",98121,Belltown
1677,Targy's Tavern,Bar,Bar,4.6,233.0,"Targy's Tavern, 600 W Crockett St, Seattle, WA 98119",98119,Other
1678,Hale's Ales Brewery,Brewery,"Brewery, Brewpub",4.3,577.0,"Hale's Ales Brewery, 4301 Leary Wy NW, Seattle, WA 98107",98107,Ballard
1679,Shinya Shokudo,Japanese restaurant,"Japanese restaurant, Bar, Izakaya restaurant, Kushiyaki restaurant, Yakitori restaurant",4.4,1014.0,"Shinya Shokudo, 2401 3rd Ave, Seattle, WA 98121",98121,Belltown
1684,Pete's Eggnest,Breakfast restaurant,"Breakfast restaurant, Brunch restaurant, Restaurant",4.6,1005.0,"Pete's Eggnest, 7717 Greenwood Ave N, Seattle, WA 98103",98103,Fremont/Wallingford
1691,Siam Bistro,Thai restaurant,Thai restaurant,4.5,136.0,"Siam Bistro, 12534 Aurora Ave N, Seattle, WA 98133",98133,Bitter Lake
1692,Wing Dome,Chicken wings restaurant,Chicken wings restaurant,3.1,176.0,"Wing Dome, 305 Harrison St, Seattle, WA 98109",98109,Queen Anne/South Lake Union
1694,Jade Restaurant and Lounge,Chinese restaurant,Chinese restaurant,4.4,25.0,"Jade Restaurant and Lounge, 8904 Aurora Ave N, Seattle, WA 98103",98103,Fremont/Wallingford
1695,Zen Noodle & Cafe,Chinese restaurant,"Chinese restaurant, Restaurant",4.0,114.0,"Zen Noodle & Cafe, 4537 University Way NE A, Seattle, WA 98105",98105,University District
1696,La Costa,Restaurant,"Restaurant, Bar, Latin American restaurant, Mexican restaurant",4.4,1562.0,"La Costa, 206 SW 152nd St, Seattle, WA 98166",98166,Other
1697,Olmstead,American restaurant,American restaurant,4.4,620.0,"Olmstead, 314 Broadway E, Seattle, WA 98102",98102,Capitol Hill
1699,The Shambles,Restaurant,"Restaurant, Beer hall, Cocktail bar, Steak house",4.7,745.0,"The Shambles, 7777 15th Ave NE, Seattle, WA 98115",98115,Other
1700,Dog In the Park,Hot dog stand,Hot dog stand,4.4,243.0,"Dog In the Park, 1520 4th Ave, Seattle, WA 98101",98101,Downtown
1701,KFC,Chicken restaurant,"Chicken restaurant, Fast food restaurant",2.9,463.0,"KFC, 210 W Mercer St, Seattle, WA 98119",98119,Other
1702,Cheeky Cafe,Restaurant,"Restaurant, American restaurant, Asian restaurant, Breakfast restaurant, Cafe, Coffee shop, Takeout Restaurant, Sandwich shop",4.5,711.0,"Cheeky Cafe, 1700 S Jackson St, Seattle, WA 98144",98144,Other
1703,Saffron Grill,Restaurant,Restaurant,4.4,3514.0,"Saffron Grill, 2132 N Northgate Way, Seattle, WA 98133",98133,Bitter Lake
1704,Tippe and Drague Alehouse,Pub,"Pub, Restaurant",4.6,321.0,"Tippe and Drague Alehouse, 3315 Beacon Ave S, Seattle, WA 98144",98144,Other
1705,7-Eleven,Convenience store,Convenience store,2.5,107.0,"7-Eleven, 810 3rd Ave, Seattle, WA 98104",98104,Chinatown
1706,Plum Bistro,Vegan restaurant,"Vegan restaurant, Bar, Bistro, Organic restaurant, Restaurant, Vegetarian restaurant",4.4,1810.0,"Plum Bistro, 1429 12th Ave, Seattle, WA 98122",98122,Capitol Hill
1707,Witness,Southern restaurant (US),"Southern restaurant (US), Bar, Brunch restaurant, New American restaurant",4.5,1174.0,"Witness, 410 Broadway E, Seattle, WA 98102",98102,Capitol Hill
1708,Honey Court Seafood Restaurant,Cantonese restaurant,"Cantonese restaurant, Dim sum restaurant, Restaurant, Seafood restaurant",4.2,2144.0,"Honey Court Seafood Restaurant, 516 Maynard Ave S, Seattle, WA 98104",98104,Chinatown
1709,Sushi Tokyo,Japanese restaurant,"Japanese restaurant, Sushi restaurant",4.1,311.0,"Sushi Tokyo, 6311 Roosevelt Way NE, Seattle, WA 98115",98115,Other
1712,Beyond The Bowl,Japanese restaurant,Japanese restaurant,4.5,335.0,"Beyond The Bowl, 12518 Lake City Way NE, Seattle, WA 98125",98125,Northgate
1714,Pho Viet Anh,Vietnamese restaurant,"Vietnamese restaurant, Asian restaurant, Pho restaurant, Southeast Asian restaurant",4.5,879.0,"Pho Viet Anh, 2621 5th Ave, Seattle, WA 98121",98121,Belltown
1715,Limoncello Belltown,Italian restaurant,Italian restaurant,4.3,367.0,"Limoncello Belltown, 2326 1st Ave, Seattle, WA 98121",98121,Belltown
1717,Un Bien,Sandwich shop,"Sandwich shop, Caribbean restaurant, Restaurant",4.8,656.0,"Un Bien, 6226 Seaview Ave NW, Seattle, WA 98107",98107,Ballard
1718,Drip Tea,Cafe,Cafe,4.4,385.0,"Drip Tea, 1416 10th Ave, Seattle, WA 98122",98122,Capitol Hill
1720,Xi'an Noodles,Chinese restaurant,"Chinese restaurant, Asian restaurant, Noodle shop",4.4,1595.0,"Xi'an Noodles, 5259 University Way NE, Seattle, WA 98105",98105,University District
1725,Sushi By Scratch Restaurants: Seattle,Sushi restaurant,Sushi restaurant,4.3,109.0,"Sushi By Scratch Restaurants: Seattle, 2331 6th Ave, Seattle, WA 98121",98121,Belltown
1726,The Comfort Zone Restaurant,Soul food restaurant,"Soul food restaurant, American restaurant, Caterer, Family restaurant, Restaurant",4.5,282.0,"The Comfort Zone Restaurant, 5016 Rainier Ave S, Seattle, WA 98118",98118,Other
1728,Spice Waala,Indian restaurant,"Indian restaurant, Asian restaurant, Halal restaurant, Indian takeaway, Restaurant",4.5,514.0,"Spice Waala, 340 15th Ave E #202, Seattle, WA 98112",98112,Capitol Hill
1729,Ancient Grounds,Art gallery,"Art gallery, Ethnographic museum, Kimono store",4.6,92.0,"Ancient Grounds, 1220 1st Ave, Seattle, WA 98101",98101,Downtown
1730,Ampersand Cafe on Alki,Coffee shop,Coffee shop,4.4,381.0,"Ampersand Cafe on Alki, 2536 Alki Ave SW, Seattle, WA 98116",98116,Other
1731,125th Street Grill,American restaurant,"American restaurant, Banquet hall, Breakfast restaurant",4.0,520.0,"125th Street Grill, 12255 Aurora Ave N, Seattle, WA 98133",98133,Bitter Lake
1732,Alaska Silk Pie Co.,Dessert shop,"Dessert shop, Bakery, Gluten-free restaurant, Wholesale bakery",4.9,18.0,"Alaska Silk Pie Co., 3429 Airport Way S 2nd Fl, Seattle, WA 98134",98134,Other
1735,Subway,Sandwich shop,"Sandwich shop, Caterer, Fast food restaurant, Takeout Restaurant, Restaurant",3.8,139.0,"Subway, 6515 California Ave SW, Seattle, WA 98136",98136,Other
1736,Gelatiamo,Ice cream shop,"Ice cream shop, Bakery, Cake shop, Coffee shop",4.6,1211.0,"Gelatiamo, 1400 3rd Ave, Seattle, WA 98101",98101,Downtown
1737,La Vita E Bella,Italian restaurant,"Italian restaurant, Mediterranean restaurant, Pizza restaurant, Restaurant",4.3,1047.0,"La Vita E Bella, 2411 2nd Ave, Seattle, WA 98121",98121,Belltown
1738,Wonder Ethiopian Restaurant Sport Bar,Ethiopian restaurant,Ethiopian restaurant,4.3,367.0,"Wonder Ethiopian Restaurant Sport Bar, 1800 S Jackson St, Seattle, WA 98144",98144,Other
1739,The Old Pequliar,Irish pub,Irish pub,4.4,508.0,"The Old Pequliar, 1722 NW Market St, Seattle, WA 98107",98107,Ballard
1740,An Nam Pho,Vietnamese restaurant,Vietnamese restaurant,4.4,447.0,"An Nam Pho, 6510 Roosevelt Way NE, Seattle, WA 98115",98115,Other
1741,Elephant & Castle,Restaurant,Restaurant,4.2,1640.0,"Elephant & Castle, 1415 5th Ave, Seattle, WA 98101",98101,Downtown
1742,Starbucks,Coffee shop,"Coffee shop, Breakfast restaurant, Cafe, Coffee store, Espresso bar, Internet cafe",4.3,134.0,"Starbucks, 2650 NE 49th St, Seattle, WA 98105",98105,University District
1747,The Barrel Thief,Restaurant,"Restaurant, Wine bar",4.5,484.0,"The Barrel Thief, 3417 Evanston Ave N #102, Seattle, WA 98103",98103,Fremont/Wallingford
1748,Red Star Taco Bar,Mexican restaurant,"Mexican restaurant, Bar, Restaurant, Taco restaurant",4.5,1236.0,"Red Star Taco Bar, 513 N 36th St, Seattle, WA 98103",98103,Fremont/Wallingford
1749,Pablo y Pablo,Mexican restaurant,"Mexican restaurant, Brunch restaurant, Cocktail bar, Lunch restaurant, Restaurant, Taco restaurant",4.3,1272.0,"Pablo y Pablo, 1605 N 34th St, Seattle, WA 98103",98103,Fremont/Wallingford
1750,Homer,Restaurant,Restaurant,4.7,540.0,"Homer, 3013 Beacon Ave S, Seattle, WA 98144",98144,Other
1752,Shultzy's Bar & Grill,Bar & grill,"Bar & grill, Restaurant, Sports bar",4.3,1191.0,"Shultzy's Bar & Grill, 4114 University Way NE, Seattle, WA 98105",98105,University District
1753,Fuji Sushi,Sushi restaurant,"Sushi restaurant, Asian restaurant, Fujian restaurant, Japanese restaurant, Restaurant",4.5,811.0,"Fuji Sushi, 520 South Main St, Seattle, WA 98104",98104,Chinatown
1754,Pizzeria Pulcinella,Pizza restaurant,Pizza restaurant,4.7,1235.0,"Pizzeria Pulcinella, 10003 Rainier Ave S, Seattle, WA 98178",98178,Other
1755,Husky Deli & Catering & Ice Cream,Ice cream shop,"Ice cream shop, Breakfast restaurant, Catering food and drink supplier, Deli, European restaurant, Sandwich shop",4.7,1235.0,"Husky Deli & Catering & Ice Cream, 4721 California Ave SW, Seattle, WA 98116",98116,Other
1756,Thaiger Room,Thai restaurant,Thai restaurant,3.7,355.0,"Thaiger Room, 1312 NE 43rd St, Seattle, WA 98105",98105,University District
1757,The Mountaineering Club,Bar,Bar,4.2,578.0,"The Mountaineering Club, 4507 Brooklyn Ave NE, Seattle, WA 98105",98105,University District
1758,Roji Monster Ice Cream,Dessert shop,"Dessert shop, Ice cream shop",4.3,140.0,"Roji Monster Ice Cream, 5000 University Way NE Suite E, Seattle, WA 98105",98105,University District
1760,FIT BAR Superfood Cafe,Cafe,Cafe,4.3,139.0,"FIT BAR Superfood Cafe, 2222 California Ave SW, Seattle, WA 98116",98116,Other
1761,The Essential Baking Company,Wholesale bakery,Wholesale bakery,5.0,5.0,"The Essential Baking Company, 5601 1st Ave S, Seattle, WA 98108",98108,Other
1765,Matador Ballard,Mexican restaurant,"Mexican restaurant, Bar, Catering food and drink supplier, Caterer",4.4,2048.0,"Matador Ballard, 5410 Ballard Ave NW, Seattle, WA 98107",98107,Ballard
1766,Din Tai Fung,Chinese restaurant,"Chinese restaurant, Bar, Dumpling restaurant",4.5,4222.0,"Din Tai Fung, 600 Pine St #403, Seattle, WA 98101",98101,Downtown
1768,The Yard Cafe,Restaurant,"Restaurant, Bar, Pub",4.4,664.0,"The Yard Cafe, 8313 Greenwood Ave N, Seattle, WA 98103",98103,Fremont/Wallingford
1769,Mediterranean Mix,Restaurant,Restaurant,3.9,66.0,"Mediterranean Mix, 205 1st Ave S, Seattle, WA 98104",98104,Chinatown
1771,Mori Sushi,Japanese restaurant,"Japanese restaurant, Sushi restaurant",2.7,58.0,"Mori Sushi, 101 NW 85th St #102, Seattle, WA 98103",98103,Fremont/Wallingford
1773,Bizzarro Italian Cafe,Italian restaurant,Italian restaurant,4.6,1120.0,"Bizzarro Italian Cafe, 1307 N 46th St, Seattle, WA 98103",98103,Fremont/Wallingford
1775,Retro Restaurant & Lounge,American restaurant,"American restaurant, Bar, Hamburger restaurant, Restaurant",4.4,608.0,"Retro Restaurant & Lounge, 216 Stewart St, Seattle, WA 98101",98101,Downtown
1776,Din Tai Fung,Chinese restaurant,"Chinese restaurant, Dim sum restaurant, Restaurant",4.6,3392.0,"Din Tai Fung, 2621 NE 46th St, Seattle, WA 98105",98105,University District
1778,7-Eleven,Convenience store,Convenience store,2.1,116.0,"7-Eleven, 819 Virginia St, Seattle, WA 98101",98101,Downtown
1780,Sugar Hill,Thai restaurant,"Thai restaurant, Bar, Event venue, Lounge, Restaurant",4.2,504.0,"Sugar Hill, 414 E Pine St, Seattle, WA 98122",98122,Capitol Hill
1781,Red Lantern,Chinese restaurant,"Chinese restaurant, Bar, Korean restaurant, Delivery Restaurant, Restaurant",4.2,203.0,"Red Lantern, 520 S Jackson St, Seattle, WA 98104",98104,Chinatown
1782,Zocalo,Mexican restaurant,"Mexican restaurant, Restaurant",4.0,374.0,"Zocalo, 224 Occidental Ave S, Seattle, WA 98104",98104,Chinatown
1786,Taqueria El Asadero,Mexican restaurant,"Mexican restaurant, Taco restaurant",4.4,839.0,"Taqueria El Asadero, 3513 Rainier Ave S, Seattle, WA 98144",98144,Other
1787,Heaven Sent Fried Chicken,Chicken restaurant,"Chicken restaurant, Fast food restaurant, Restaurant",4.1,907.0,"Heaven Sent Fried Chicken, 14330 Lake City Way NE, Seattle, WA 98125",98125,Northgate
1788,Gokan Sushi & Katsu,Sushi restaurant,"Sushi restaurant, Japanese restaurant",4.3,455.0,"Gokan Sushi & Katsu, 954 E Union St, Seattle, WA 98122",98122,Capitol Hill
1791,The Original Philly's,American restaurant,"American restaurant, Cheesesteak restaurant, Takeout Restaurant, Pizza restaurant, Sandwich shop",4.3,1226.0,"The Original Philly's, 3019 Martin Luther King Jr Way S, Seattle, WA 98144",98144,Other
1793,Gyro Time Restaurant,Mediterranean restaurant,"Mediterranean restaurant, Gyro restaurant, Restaurant",4.6,604.0,"Gyro Time Restaurant, 10400 Greenwood Ave N, Seattle, WA 98133",98133,Bitter Lake
1795,Dong Thap Noodles,Vietnamese restaurant,"Vietnamese restaurant, Delivery Restaurant, Noodle shop, Pho restaurant, Restaurant",4.3,742.0,"Dong Thap Noodles, 303 12th Ave S Suite A, Seattle, WA 98144",98144,Other
1798,Cactus Madison Park,Mexican restaurant,"Mexican restaurant, Family restaurant",4.6,1043.0,"Cactus Madison Park, 4220 E Madison St, Seattle, WA 98112",98112,Capitol Hill
1799,Evoke Cafe Bar,Cafe,Cafe,4.6,406.0,"Evoke Cafe Bar, 234 9th Ave N, Seattle, WA 98109",98109,Queen Anne/South Lake Union
1800,Cafetal Quilombo Cafe,Mexican restaurant,"Mexican restaurant, Cafe, Caterer, Tamale shop",4.8,334.0,"Cafetal Quilombo Cafe, 4343 15th Ave S, Seattle, WA 98108",98108,Other
1801,SPIN Seattle,Bar & grill,"Bar & grill, Lounge, Restaurant, Sports bar",4.6,1095.0,"SPIN Seattle, 1511 6th Ave, Seattle, WA 98101",98101,Downtown
1802,Homegrown,Sandwich shop,"Sandwich shop, Cafe, Coffee shop, Restaurant, Salad shop",4.4,407.0,"Homegrown, 208 Westlake Ave N, Seattle, WA 98109",98109,Queen Anne/South Lake Union
1805,Phayathai Cuisine,Thai restaurant,"Thai restaurant, Asian restaurant, Restaurant, Southeast Asian restaurant",4.5,258.0,"Phayathai Cuisine, 8917 Lake City Way NE, Seattle, WA 98115",98115,Other
1806,Starbucks,Coffee shop,"Coffee shop, Breakfast restaurant, Cafe, Coffee store, Espresso bar, Internet cafe",4.2,367.0,"Starbucks, Elliott Hotel, 1524 7th Ave, Seattle, WA 98101",98101,Downtown
1808,Kati Vegan Thai,Vegan restaurant,"Vegan restaurant, Thai restaurant",4.4,1129.0,"Kati Vegan Thai, 1190 Thomas St, Seattle, WA 98109",98109,Queen Anne/South Lake Union
1810,JOEY University Village,Restaurant,"Restaurant, Pub",4.3,1620.0,"JOEY University Village, 2603 NE 46th St, Seattle, WA 98105",98105,University District
1811,Zane+Wylie's Seattle Steakhouse,Steak house,Steak house,4.2,228.0,"Zane+Wylie's Seattle Steakhouse, 624 Olive Wy #1717, Seattle, WA 98101",98101,Downtown
1812,Aburiya Bento House,Sushi restaurant,Sushi restaurant,4.5,408.0,"Aburiya Bento House, 2100 Western Ave b, Seattle, WA 98121",98121,Belltown
1813,YangGuoFu YGF MalaTang,Restaurant,Restaurant,4.2,172.0,"YangGuoFu YGF MalaTang, 4730 University Way NE Suite #103, Seattle, WA 98105",98105,University District
1814,Ton Kiang Barbeque Noodle House,Chinese restaurant,"Chinese restaurant, Asian restaurant, Barbecue restaurant",4.4,158.0,"Ton Kiang Barbeque Noodle House, 668 S Weller St, Seattle, WA 98104",98104,Chinatown
1815,Buca di Beppo Italian Restaurant,Italian restaurant,"Italian restaurant, Family restaurant",4.1,2519.0,"Buca di Beppo Italian Restaurant, 701 Westlake Ave N, Seattle, WA 98109",98109,Queen Anne/South Lake Union
1816,Tortuga,Coffee stand,Coffee stand,5.0,15.0,"Tortuga, 6300 Seaview Ave NW, Seattle, WA 98107",98107,Ballard
1818,Poke Fresh,Poke bar,"Poke bar, Hawaiian restaurant",3.7,271.0,"Poke Fresh, 1026 NE 65th St, Seattle, WA 98115",98115,Other
1819,Caffe Vita,Coffee roasters,"Coffee roasters, Coffee shop",4.4,850.0,"Caffe Vita, 1005 E Pike St, Seattle, WA 98122",98122,Capitol Hill
